id,conversation_id,created_at,date,time,timezone,user_id,username,name,place,tweet,language,mentions,urls,photos,replies_count,retweets_count,likes_count,hashtags,cashtags,link,retweet,quote_url,video,thumbnail,near,geo,source,user_rt_id,user_rt,retweet_id,reply_to,retweet_date,translate,trans_src,trans_dest
1.18797E+18,1.18797E+18,2019-10-26 05:45:21 UTC,26-10-2019,05:45:21,0,1940561376,andreas_krieg,Dr Andreas Krieg,,"@ecfr Paper on #China's engagement with the MENA region - as @jonathandfulton argues China's ties with the region are about energy, infrastructure &amp; nuclear energy plus high tech #Saudi #UAE #Qatar #Iran #Iraq #Egypt #Algeria   https://t.co/LQS2LsrzcI  https://t.co/GbAemfUfpx",en,"[{'screen_name': 'jonathandfulton', 'name': 'jonathan fulton', 'id': '375592591'}]",['https://www.ecfr.eu/publications/summary/china_great_game_middle_east#'],['https://pbs.twimg.com/media/EHyC_g4WwAA-Fw-.jpg'],0,4,1,"['china', 'saudi', 'uae', 'qatar', 'iran', 'iraq', 'egypt', 'algeria']",[],https://twitter.com/andreas_krieg/status/1187968435260665858,FALSE,,1,https://pbs.twimg.com/media/EHyC_g4WwAA-Fw-.jpg,,,,,,,[],,,,
1.18714E+18,1.18714E+18,2019-10-23 23:12:21 UTC,23-10-2019,23:12:21,0,1.1712E+18,positiveafro,Afro_Positive,,Most developed countries in Africa in terms of Infrastructure 1. Seychelles 2. Egypt 3. Libya 4. South Africa 5. Mauritius 6. Tunisia 7. Morocco 8. Algeria 9. Cabo Verde 10. Botswana  Source African Development Bank 2018 AIDI,en,[],[],[],0,1,6,[],[],https://twitter.com/PositiveAfro/status/1187144761091776513,FALSE,,0,,,,,,,,[],,,,
1.18705E+18,1.18705E+18,2019-10-23 16:57:38 UTC,23-10-2019,16:57:38,0,3315017925,davidhundeyin,David Hundeyin,,"Discussion theme is around the role of data in African govt policy making, using the infrastructure investment strategies of Algeria/Morocco as a contrast to the ""unviable airport in the middle of nowhere"" strategy in Nigeria.",en,[],[],[],1,9,11,[],[],https://twitter.com/DavidHundeyin/status/1187050458583580673,FALSE,,0,,,,,,,,[],,,,
1.18592E+18,1.18592E+18,2019-10-20 14:05:06 UTC,20-10-2019,14:05:06,0,9.65422E+17,bylka613_,Walid Ziani,,"@ais_ot @DZfoot_EN Because living in Qatar is probably much better than living in Algeria, and a club like Al-Duhail has much better infrastructure than any Algerian club (or the national team for that matter)",en,[],[],[],1,0,2,[],[],https://twitter.com/bylka613_/status/1185919875828670464,FALSE,,0,,,,,,,,"[{'screen_name': 'ais_ot', 'name': 'O.T AIS', 'id': '2719990642'}, {'screen_name': 'DZfoot_EN', 'name': 'DZfoot English 🇩🇿⚽️', 'id': '747127299091267584'}]",,,,
1.18531E+18,1.1853E+18,2019-10-18 21:26:38 UTC,18-10-2019,21:26:38,0,8.46105E+17,suky_samuel,BORNO OF AFRICA,,"@mrmanhere_ @volqx Which African countries? Compare Nigeria with her peers such as  Egypt,SouthAfrica, Ethiopia, Morocco, Algeria and Kenya You will see that those countries are ahead of us in one infrastructure",en,[],[],[],1,0,0,[],[],https://twitter.com/suky_samuel/status/1185306217595453440,FALSE,,0,,,,,,,,"[{'screen_name': 'mrmanhere_', 'name': 'AJ | Adonai', 'id': '1302220897'}, {'screen_name': 'volqx', 'name': 'Volqx', 'id': '471918222'}]",,,,
1.18514E+18,1.18483E+18,2019-10-18 10:24:42 UTC,18-10-2019,10:24:42,0,1.17291E+18,oanwah,Hon Charles oseoji,,"@stellaoduah Stella has done a lot of infrastructure in Nigeria,  mostly in Anambra north,  ride on my senator,  from oseoji onitsha live from Algeria",en,[],[],[],0,0,0,[],[],https://twitter.com/OAnwah/status/1185139636772966401,FALSE,,0,,,,,,,,"[{'screen_name': 'stellaoduah', 'name': 'Senator Stella Oduah', 'id': '329094741'}]",,,,
1.18449E+18,1.18449E+18,2019-10-16 15:30:07 UTC,16-10-2019,15:30:07,0,9.31634E+17,asantejnrruhima,Ruhima Jonah,,"economy South Africa: 746,978 km. Nigeria has 195,000km. Kenya: 177,800km. Uganda:159,364km. Algeria: 104,000km. Tanzania: 86,472km. Egypt: 65,050km. Botswana: 10,217km. Seychelles: 526km. Such infrastructure devlpmnt has hugely supported economic productivity &amp; other gains.  https://t.co/UT8K2WahTp",ro,[],[],"['https://pbs.twimg.com/media/EHAo7wiW4AEJgQS.jpg', 'https://pbs.twimg.com/media/EHAo7wdW4AIHjKG.jpg', 'https://pbs.twimg.com/media/EHAo7xYWsAA8irw.jpg', 'https://pbs.twimg.com/media/EHAo7yhX4AINLxS.jpg']",0,0,2,[],[],https://twitter.com/AsantejnrRuhima/status/1184491718802132992,FALSE,,1,https://pbs.twimg.com/media/EHAo7wiW4AEJgQS.jpg,,,,,,,[],,,,
1.18441E+18,1.18441E+18,2019-10-16 09:57:17 UTC,16-10-2019,09:57:17,0,831148194,rcreee,RCREEE,,"Event_Alert: Under @meetMED1 activities, @RCREEE is organizing workshop on ""Assessing the Existing Quality Infrastructures for EE and RES Equipment and Services in the SEMCs in #Algeria.. More details   https://t.co/U7T6eaG8pt  https://t.co/z4BQB7eOgh",en,"[{'screen_name': 'meetmed1', 'name': 'meetmed – together we switch to clean energy', 'id': '1027581358674194433'}, {'screen_name': 'rcreee', 'name': 'rcreee', 'id': '831148194'}]",['http://www.rcreee.org/content/meetmed-workshop-assessing-existing-quality-infrastructures-ee-and-res-equipment-and'],['https://pbs.twimg.com/media/EG_cv8wXYAAG2xf.jpg'],0,1,2,['algeria'],[],https://twitter.com/RCREEE/status/1184407958345650176,FALSE,,1,https://pbs.twimg.com/media/EG_cv8wXYAAG2xf.jpg,,,,,,,[],,,,
1.18408E+18,1.18408E+18,2019-10-15 11:58:35 UTC,15-10-2019,11:58:35,0,990802033,euwatchers,EUwatch,,Spanish utility Naturgy and Algeria’s Sonatrach now entirely own strategic infrastructure  https://t.co/FMcJjFzB7I #EU #EUpol  https://t.co/sh2w4iOL49,en,[],['https://www.ft.com/content/c18eeba8-ef40-11e9-ad1e-4367d8281195'],['https://pbs.twimg.com/media/EG6u77YWoAAOMLR.png'],0,0,0,"['eu', 'eupol']",[],https://twitter.com/EUwatchers/status/1184076097891323905,FALSE,,1,https://pbs.twimg.com/media/EG6u77YWoAAOMLR.png,,,,,,,[],,,,
1.18407E+18,1.18407E+18,2019-10-15 11:51:50 UTC,15-10-2019,11:51:50,0,1482385556,osbtest,Xyz Test,,Spanish utility Naturgy and Algeria’s Sonatrach now entirely own strategic infrastructure  https://t.co/dg0KfAuxuQ,en,[],['https://on.ft.com/2MGjbgN'],[],0,0,0,[],[],https://twitter.com/osbtest/status/1184074398623551488,FALSE,,0,,,,,,,,[],,,,
1.18304E+18,1.18221E+18,2019-10-12 15:10:12 UTC,12-10-2019,15:10:12,0,836958060,fnnebe,Frank Nnebe,,@desounds @BlackIgboLord @OlaniyiOye Oil was a basis that a sensible government would have used to elevate itself. Look at Algeria. It spent over 40 billion on infrastructure over the last 10 years. Goodluck and friends had over 200 billion to play with and we led the world in champagne importation and private jets.,en,[],[],[],2,0,0,[],[],https://twitter.com/FNnebe/status/1183037155960074246,FALSE,,0,,,,,,,,"[{'screen_name': 'desounds', 'name': 'mbopo', 'id': '1053473118071726081'}, {'screen_name': 'BlackIgboLord', 'name': 'Dictator Major Gen Buhari', 'id': '2709136675'}, {'screen_name': 'OlaniyiOye', 'name': 'Oye Olaniyi', 'id': '870509919669059584'}]",,,,
1.18293E+18,1.18273E+18,2019-10-12 07:55:38 UTC,12-10-2019,07:55:38,0,8.93671E+17,medvictopma,AtlasFire⁦⁦⁦⁦⁦⁦🛡️🇲🇦,,"@Abbe8888 @Duncan_Webb_ I think that Algeria, or rather your ideal, with its vastness and richness of wealth, has not reached the level of upgrading its fragile southern cities and lack of infrastructure.  https://t.co/yxWHl4T0VD",en,[],[],['https://pbs.twimg.com/media/EGqajtfWkAAFQXQ.jpg'],2,4,9,[],[],https://twitter.com/Medvictopma/status/1182927792872316928,FALSE,,1,https://pbs.twimg.com/media/EGqajtfWkAAFQXQ.jpg,,,,,,,"[{'screen_name': 'Abbe8888', 'name': 'abbe', 'id': '2898914231'}, {'screen_name': 'Duncan_Webb_', 'name': 'Duncan_Webb_', 'id': '169451041'}]",,,,
1.17935E+18,1.17935E+18,2019-10-02 10:46:01 UTC,02-10-2019,10:46:01,0,334546994,standards_my,Standards Malaysia,,"Thanks for 12 participants from Indonesia, Philippines, Egypt, Algeria, Nigeria &amp; Sudan attending the Malaysian Technical Cooperation Programme(MTCP) on Halal Standards and Conformance Infrastructure for ASEAN and OIC Countries 2019 from 17 – 27 Sept. 2019,Putrajaya  https://t.co/lYWBTk5QN0",en,[],[],['https://pbs.twimg.com/media/EF3hp2BXUAEdmhT.jpg'],0,1,0,[],[],https://twitter.com/STANDARDS_MY/status/1179346792917405697,FALSE,,1,https://pbs.twimg.com/media/EF3hp2BXUAEdmhT.jpg,,,,,,,[],,,,
1.17601E+18,1.17601E+18,2019-09-23 05:34:57 UTC,23-09-2019,05:34:57,0,8.13095E+17,molefhekarabo,Makara,,In terms of quality infrastructure rankings we’re at position 10 below  1Seychelles 2 Egypt 3 Mauritius 4 Libya 5 South Africa 6 Tunisia 7 Algeria 8 Morocco 9 Cabo Verde 10 Botswana,en,[],[],[],0,0,0,[],[],https://twitter.com/MolefheKarabo/status/1176007022510301184,FALSE,,0,,,,,,,,[],,,,
1.17264E+18,1.17264E+18,2019-09-13 22:37:20 UTC,13-09-2019,22:37:20,0,173692166,saf0113,Safdar Hussain,,Excellent. Morocco using its tourism revenue to further improve infrastructure while Algeria wastes its oil money to ferment wars and destabilisation,en,[],[],[],0,0,0,[],[],https://twitter.com/saf0113/status/1172640434759376899,FALSE,https://twitter.com/CORCAS_AUTONOMY/status/1172639759203741697,0,,,,,,,,[],,,,
1.17225E+18,1.17225E+18,2019-09-12 20:57:02 UTC,12-09-2019,20:57:02,0,3157908304,sofiannaceur,Sofian Philip Naceur,,"Heavy rain in #Algeria floods once again neighborhoods in several cities, turns the capital's metro into a swimming pool. Heavy rain falls are not new in the country, but even relatively new infrastructure projects were not build to withstand heavy rain #Alger",en,[],[],[],0,2,1,"['algeria', 'alger']",[],https://twitter.com/SofianNaceur/status/1172252805878493190,FALSE,https://twitter.com/Fmetaoui/status/1172251275255320578,0,,,,,,,,[],,,,
1.17176E+18,1.1717E+18,2019-09-11 12:36:34 UTC,11-09-2019,12:36:34,0,836958060,fnnebe,Frank Nnebe,,"@zenghishan @markessien They have not. If they did 60% of it was stolen. If you want to understand how serious countries execute infrastructure take Algeria. 2012 they had capacity of 12GW, today they are have hit 19GW.",en,[],[],[],1,0,0,[],[],https://twitter.com/FNnebe/status/1171764470819016704,FALSE,,0,,,,,,,,"[{'screen_name': 'zenghishan', 'name': 'Ōoka Tadasuke', 'id': '69581132'}, {'screen_name': 'markessien', 'name': 'Mark Essien', 'id': '16201796'}]",,,,
1.17102E+18,1.17074E+18,2019-09-09 11:27:55 UTC,09-09-2019,11:27:55,0,246581527,geoffdporter,Geoff D. Porter,,"@souamesfarah Yes, as @SMAOUH said already, there is no shale gas exploitation in #Algeria at this moment.   There is no infrastructure to support it.",en,"[{'screen_name': 'smaouh', 'name': 'sπδil', 'id': '72328531'}]",[],[],0,0,2,['algeria'],[],https://twitter.com/geoffdporter/status/1171022419039010816,FALSE,,0,,,,,,,,"[{'screen_name': 'souamesfarah', 'name': 'Farah | فرح 😷', 'id': '1562965412'}]",,,,
1.17073E+18,1.17062E+18,2019-09-08 15:46:25 UTC,08-09-2019,15:46:25,0,8.61187E+17,iam_turnt22,𝕬𝖑𝖊𝖝🍁,,"@AfricaFactsZone But in terms of infrastructure,it's Egypt,Algeria and South Africa..Get yo facts right people!!!",en,[],[],[],3,0,0,[],[],https://twitter.com/Iam_Turnt22/status/1170725083322748929,FALSE,,0,,,,,,,,"[{'screen_name': 'AfricaFactsZone', 'name': 'Africa Facts Zone', 'id': '129009730'}]",,,,
1.17069E+18,1.17062E+18,2019-09-08 13:32:19 UTC,08-09-2019,13:32:19,0,1.09841E+18,ericjoh40130670,Eric Johnson 🦅🇺🇸,,"@TheOG58770505 @AfricaFactsZone In the infrastructure field maybe Morocco is taking the lead, but when it comes to #HDI and life expectancy it is a big NO! #Seychelles, #Tunisia and #Algeria have higher rates than #Morocco, btw i like Morocco so much and still think it's one of the greatest nations in #africa",en,[],[],[],3,0,6,"['hdi', 'seychelles', 'tunisia', 'algeria', 'morocco', 'africa']",[],https://twitter.com/EricJoh40130670/status/1170691335520755712,FALSE,,0,,,,,,,,"[{'screen_name': 'TheOG58770505', 'name': 'The OG', 'id': '1165234569169297409'}, {'screen_name': 'AfricaFactsZone', 'name': 'Africa Facts Zone', 'id': '129009730'}]",,,,
1.17062E+18,1.17062E+18,2019-09-08 09:01:11 UTC,08-09-2019,09:01:11,0,591975275,tellatemitayo,TELLA Temitayo,,"AfricaFactsZone: Most Developed Countries In Africa by Human Development Index, Standard of Living, Life Expectancy and Infrastructure.  1. Mauritius  2. Morocco  3. Algeria  4. Tunisia  5. South Africa  6. Seychelles.",en,[],[],[],0,0,0,[],[],https://twitter.com/tellatemitayo/status/1170623104802021376,FALSE,,0,,,,,,,,[],,,,
1.16953E+18,1.16921E+18,2019-09-05 08:53:46 UTC,05-09-2019,08:53:46,0,7.09769E+17,bukenyakabiito,KBM🇺🇬🇿🇦,,"@phashasha @TimesLIVE It's bcz the whites stayed longer compared to other African countries, reason for such infrastructure. Same applies to Mauritius, Algeria. Check countries like Congo which is richer than South Africa in terms of resources, u will cry",en,[],[],[],0,0,1,[],[],https://twitter.com/BukenyaKabiito/status/1169534072651227136,FALSE,,0,,,,,,,,"[{'screen_name': 'phashasha', 'name': 'Harold Phashasha Pha', 'id': '110690856'}, {'screen_name': 'TimesLIVE', 'name': 'Times LIVE', 'id': '6959082'}]",,,,
1.16927E+18,1.16927E+18,2019-09-04 15:34:27 UTC,04-09-2019,15:34:27,0,2491197235,winwins4africa,WW Solutions4Africa,,Giant #infrastructure #mega-projects are transforming #Africa (eg. Egypt's brand new capital to Algeria EW Highway). #sustainability #WEFA19 #AF19 @WinWinS4Africa #AfricaMarketAnalysis,en,"[{'screen_name': 'winwins4africa', 'name': 'ww solutions4africa', 'id': '2491197235'}]",[],[],0,0,1,"['infrastructure', 'mega', 'africa', 'sustainability', 'wefa19', 'af19', 'africamarketanalysis']",[],https://twitter.com/WinWinS4Africa/status/1169272521419558912,FALSE,,0,,,,,,,,[],,,,
1.16925E+18,1.16925E+18,2019-09-04 13:51:37 UTC,04-09-2019,13:51:37,0,2255352384,insidefinance,Financial - Refinitiv,,"Giant infrastructure mega-projects are transforming #Africa (eg. Egypt's brand new capital to Algeria EW Highway). Zimbabwe's President Emmerson Mnangagwa is part of this panel to discuss #sustainability, #BRI and national sovereignty. #WEFA19 #AF19 #Refinitiv  https://t.co/NIo2rtZJdk",en,[],[],['https://pbs.twimg.com/media/EDn_nsGX4AEQSd4.jpg'],0,23,7,"['africa', 'sustainability', 'bri', 'wefa19', 'af19', 'refinitiv']",[],https://twitter.com/insidefinance/status/1169246641859305472,FALSE,,1,https://pbs.twimg.com/media/EDn_nsGX4AEQSd4.jpg,,,,,,,[],,,,
1.16817E+18,1.1678E+18,2019-09-01 14:40:57 UTC,01-09-2019,14:40:57,0,17804262,corcas_autonomy,CORCAS,,@EricJoh40130670 @WSahara1 @hallaboutafrica It’s true that #Morocco including #WesternSahara #territory has the best infrastructure in mother #Africa but what’s the link with WS territory issue opposing Morocco to algeria #military #dictature since 1975? #SaharaOccidental #AlgeriaSCAMWillNeverBe #AlgeriaMeddling  https://t.co/uelPSxkg9N,en,[],[],"['https://pbs.twimg.com/media/EDYuHJaW4AArsmF.jpg', 'https://pbs.twimg.com/media/EDYuHKMWkAAvoLf.jpg']",1,0,2,"['morocco', 'westernsahara', 'territory', 'africa', 'military', 'dictature', 'saharaoccidental', 'algeriascamwillneverbe', 'algeriameddling']",[],https://twitter.com/CORCAS_AUTONOMY/status/1168171892303454211,FALSE,,1,https://pbs.twimg.com/media/EDYuHJaW4AArsmF.jpg,,,,,,,"[{'screen_name': 'EricJoh40130670', 'name': 'Eric Johnson 🦅🇺🇸', 'id': '1098408345298456576'}, {'screen_name': 'WSahara1', 'name': '🇪🇭 Sahara Libre', 'id': '4919824829'}, {'screen_name': 'hallaboutafrica', 'name': 'James Hall', 'id': '2410872103'}]",,,,
1.16666E+18,1.16666E+18,2019-08-28 10:32:13 UTC,28-08-2019,10:32:13,0,14346260,glcarlstrom,Gregg Carlstrom,,"After six months of political turmoil, Algeria's economy looks paralyzed. Big firms are cutting production and struggling to pay salaries, new laws are frozen, and infrastructure projects are on hold.  https://t.co/LZqpCfHQeX",en,[],['https://www.reuters.com/article/us-algeria-protests-economy-analysis-idUSKCN1VH0FR'],[],0,8,5,[],[],https://twitter.com/glcarlstrom/status/1166659745178095616,FALSE,,0,,,,,,,,[],,,,
1.16503E+18,1.16503E+18,2019-08-23 22:46:46 UTC,23-08-2019,22:46:46,0,44650702,basemfallatah,Basem Fallatah باسم فلاتة,,"@jimcramer American manufacturers need to get infrastructure set in Africa, as they transferred technically to China, it would be easier to set it in Africa (ex. #Moracco, Senigal, Mali, South Africa, Eygept, Ethiopia, Kennya, Tunissia, Algeria, Nigeria and others).",en,[],[],[],0,0,0,['moracco'],[],https://twitter.com/basemfallatah/status/1165032660202377217,FALSE,,0,,,,,,,,"[{'screen_name': 'jimcramer', 'name': 'Jim Cramer', 'id': '14216123'}]",,,,
1.16497E+18,1.16497E+18,2019-08-23 18:40:54 UTC,23-08-2019,18:40:54,0,2238083952,mvnoblog,MVNO BLOG,,"Algeria Mobile Infrastructure, Broadband, Operators Statistics and Analyses 2019 –  https://t.co/8sKI3cXeri – Business Wire  https://t.co/6KWcr0Rwrw",en,[],"['http://ResearchAndMarkets.com', 'http://mvnoblog.com/algeria-mobile-infrastructure-broadband-operators-statistics-and-analyses-2019-researchandmarkets-com-business-wire/']",[],0,0,0,[],[],https://twitter.com/mvnoblog/status/1164970788505755648,FALSE,,0,,,,,,,,[],,,,
1.1649E+18,1.1649E+18,2019-08-23 13:51:55 UTC,23-08-2019,13:51:55,0,1.0192E+18,picante_media,PICANTE News,,"Algeria Mobile Infrastructure, Broadband, Operators Statistics and Analyses 2019 –  https://t.co/JhlLcFc95M  https://t.co/MEYShWP1CQ",en,[],"['http://ResearchAndMarkets.com', 'https://picante.today/business-wire/2019/08/23/76713/algeria-mobile-infrastructure-broadband-operators-statistics-and-analyses-2019-researchandmarkets-com/']",[],0,0,0,[],[],https://twitter.com/Picante_Media/status/1164898061698646016,FALSE,,0,,,,,,,,[],,,,
1.1649E+18,1.1649E+18,2019-08-23 13:42:06 UTC,23-08-2019,13:42:06,0,9.76298E+17,newsfrombw,Latest News from Business Wire,,"Algeria Mobile Infrastructure, Broadband, Operators Statistics and Analyses 2019 -  https://t.co/guyiBzPH8C  https://t.co/nkDIF9bIrO  https://t.co/0l0CUsgTBQ",en,[],"['http://ResearchAndMarkets.com', 'http://dlvr.it/RBlbkX']",['https://pbs.twimg.com/media/ECqKXfeVAAAh0TN.jpg'],0,0,0,[],[],https://twitter.com/NewsFromBW/status/1164895591643504640,FALSE,,1,https://pbs.twimg.com/media/ECqKXfeVAAAh0TN.jpg,,,,,,,[],,,,
1.16395E+18,1.16395E+18,2019-08-20 23:09:28 UTC,20-08-2019,23:09:28,0,2886638325,glory243matondo,🇨🇩🐆 Glory (Glodas/Gloire/Glody) Matondo🐆🇨🇩,,"The next Afcon (if Cameroon can't host), should be given to Algeria. Holders, not far from Europe so others can travel, good infrastructure in every sense and passionate fans.   Politics is stable too",en,[],[],[],0,0,0,[],[],https://twitter.com/glory243matondo/status/1163951212762488832,FALSE,https://twitter.com/CFCTerence/status/1163947233101979649,0,,,,,,,,[],,,,
1.16391E+18,1.1639E+18,2019-08-20 20:09:20 UTC,20-08-2019,20:09:20,0,1406472242,idibid25,Idibid,,@glory243matondo Lol why winners ?...So Euro and World Cup winners too ?...Algeria certainly has the infrastructures..well I guess..but com'on they are too close to Egypt to be awarded next CAN. Better change region .,en,[],[],[],1,0,0,[],[],https://twitter.com/Idibid25/status/1163905879768469504,FALSE,,0,,,,,,,,"[{'screen_name': 'glory243matondo', 'name': '🇨🇩🐆 Glory (Glodas/Gloire/Glody) Matondo🐆🇨🇩', 'id': '2886638325'}]",,,,
1.1639E+18,1.16383E+18,2019-08-20 20:02:07 UTC,20-08-2019,20:02:07,0,1406472242,idibid25,Idibid,,"@glory243matondo It's better to change zone for each CAN, East basically never had one despite Ethiopia, Kenya being able to organize it and create infrastructures necessary for it. I'd prefer both over Algeria frankly.",en,[],[],[],0,0,0,[],[],https://twitter.com/Idibid25/status/1163904064092102659,FALSE,,0,,,,,,,,"[{'screen_name': 'glory243matondo', 'name': '🇨🇩🐆 Glory (Glodas/Gloire/Glody) Matondo🐆🇨🇩', 'id': '2886638325'}]",,,,
1.16215E+18,1.16013E+18,2019-08-15 23:54:44 UTC,15-08-2019,23:54:44,0,2218313665,youssefgizo3,Youssef El Gazzar,,"@grumbae @FortniteGame @FortniteME Nah man, you got Egypt, Tunisia, Algeria, Morocco..all are north african, mainly middle eastern countries and are not poor and have tons of players. The only reasonable place to put a server at would be Egypt, pretty much the center. But the infrastructure is shit!",en,[],[],[],1,0,0,[],[],https://twitter.com/youssefgizo3/status/1162150663935184899,FALSE,,0,,,,,,,,"[{'screen_name': 'grumbae', 'name': 'Grumbae ™®/ Gamer G', 'id': '870237705887723520'}, {'screen_name': 'FortniteGame', 'name': 'Fortnite', 'id': '425871040'}, {'screen_name': 'FortniteME', 'name': 'FortniteME', 'id': '1118297069347921926'}]",,,,
1.16169E+18,1.16169E+18,2019-08-14 17:17:54 UTC,14-08-2019,17:17:54,0,390890701,animsche,Yasmina,,#Algeria’s Head of State appoints General-Major Mustapha Oudjani as the new comptroller general of the army. General Ahmed Saoudi has also been appointed as the new Director of Military Infrastructure at the Ministry of National Defence.   Trusted figures in trusted positions.,en,[],[],[],0,2,3,['algeria'],[],https://twitter.com/animsche/status/1161688407447355392,FALSE,https://twitter.com/TSAlgerie/status/1161679768036794368,0,,,,,,,,[],,,,
1.16116E+18,1.16116E+18,2019-08-13 06:09:49 UTC,13-08-2019,06:09:49,0,3343688313,uidc_ug,UIDC,,"@GMutabaazi why are local government not functioning in the largest part of the sub-saharan Africa? Moroco, Tunisia and Algeria they work!  Join the Greatest African Urban  Infrastructure Development, Investment Discussion list  Send mail to       uidc+subscribe@googlegroups.com",en,[],[],[],0,0,0,[],[],https://twitter.com/UIDC_UG/status/1161157891774017538,FALSE,,0,,,,,,,,[],,,,
1.16114E+18,1.16114E+18,2019-08-13 04:49:51 UTC,13-08-2019,04:49:51,0,1.11021E+18,akshitaaggarw20,Akshita Aggarwal,,"#LNA sends troops (appx. 100 technicals) to southern #Libya to secure oil infrastructure and borders with #Chad, #Niger, #Sudan, #Egypt &amp; #Algeria. The forces will also reportedly be deployed along all roads between #Jufra and southern cities (#Sebha, #Murzuq, etc.)  https://t.co/s3rFBuFfjQ",en,[],[],"['https://pbs.twimg.com/media/EB0whfaUwAAqvmW.jpg', 'https://pbs.twimg.com/media/EB0whfbVAAEXI8S.jpg', 'https://pbs.twimg.com/media/EB0whfaU4AA1lA2.jpg', 'https://pbs.twimg.com/media/EB0whfbUwAAw_EA.jpg']",0,1,5,"['lna', 'libya', 'chad', 'niger', 'sudan', 'egypt', 'algeria', 'jufra', 'sebha', 'murzuq']",[],https://twitter.com/AkshitaAggarw20/status/1161137766471573504,FALSE,,1,https://pbs.twimg.com/media/EB0whfaUwAAqvmW.jpg,,,,,,,[],,,,
1.16093E+18,1.16093E+18,2019-08-12 15:00:24 UTC,12-08-2019,15:00:24,0,4849387695,wearemettanbo,Mettā Nairobi,,Top 7 African countries with good infrastructure. 1.  Algeria 2. Mozambique 3. Ethiopia 4.  Zambia 5.  Rwanda 6.  Uganda 7.  Tanzania Source: Global Innovation Index,en,[],[],[],1,3,6,[],[],https://twitter.com/WeAreMettaNBO/status/1160929029416980482,FALSE,,0,,,,,,,,[],,,,
1.1607E+18,1.1605E+18,2019-08-12 00:08:54 UTC,12-08-2019,00:08:54,0,257500875,tphedgegroup,T|P| TPHEDGEGROUP,,"@DAX30DJI30 Prome examples.....exactly what is happening in rural Poland, Eastern Ukraine, Lebanon, Belarus, Estonia, Moldova, Turkey, Algeria, Tunisia and even Senegal,......technology and improved access to electricity, infrastructure, etc. is improving the countryside as fast as cities,",en,[],[],[],0,0,0,[],[],https://twitter.com/tphedgegroup/status/1160704675034869763,FALSE,,0,,,,,,,,[],,,,
1.15878E+18,1.15878E+18,2019-08-06 16:40:28 UTC,06-08-2019,16:40:28,0,2478919627,mariaalcoptia,uyghur维吾尔 | maria,,Wallah ghir tebki 3ala bladna. Algeria is so gorgeous but none of you will ever know because the government is more interested in funnelling the wealth out instead of working on the infrastructure to show the land off,en,[],[],[],0,0,4,[],[],https://twitter.com/mariaalcoptia/status/1158779884468080646,FALSE,,0,,,,,,,,[],,,,
1.15834E+18,1.15831E+18,2019-08-05 11:38:46 UTC,05-08-2019,11:38:46,0,3197952491,tajudine2013,Teejay,,@Adimabua11 @ditanokupe This depends on your level of knowledge.  Oil has crashed globally and we didn't saved and developed our infrastructure under PDP from the Oil boom.  Algeria was able to save $194 billion but PDP could only saved $28 billion and borrowed $63 billion.  https://t.co/2BfLRmVulD,en,[],[],['https://pbs.twimg.com/media/EBNBhOAXYAElSr3.jpg'],1,0,0,[],[],https://twitter.com/tajudine2013/status/1158341571689025539,FALSE,,1,https://pbs.twimg.com/media/EBNBhOAXYAElSr3.jpg,,,,,,,"[{'screen_name': 'Adimabua11', 'name': 'Adimabua', 'id': '1150000653122584577'}]",,,,
1.15775E+18,1.15775E+18,2019-08-03 20:12:29 UTC,03-08-2019,20:12:29,0,2754997482,nidhal_mahdhi,Nidhal Mahdhi,,Algeria 🇩🇿 ❤️  #people #urbanarea #town #street #neighbourhood #city #humansettlement #pedestrian #publicspace #metropolis #crowd #snapshot #architecture #metropolitanarea #building #infrastructure #road...  https://t.co/x4D4AuOUW9,ca,[],['https://www.facebook.com/100000330781326/posts/2887093577978307/'],[],0,0,0,"['people', 'urbanarea', 'town', 'street', 'neighbourhood', 'city', 'humansettlement', 'pedestrian', 'publicspace', 'metropolis', 'crowd', 'snapshot', 'architecture', 'metropolitanarea', 'building', 'infrastructure', 'road']",[],https://twitter.com/nidhal_mahdhi/status/1157746075765133312,FALSE,,0,,,,,,,,[],,,,
1.15649E+18,1.15649E+18,2019-07-31 09:10:09 UTC,31-07-2019,09:10:09,0,549891988,fanackmena,Fanack,,"Water Infrastructure in Algeria  The water infrastructure in Algeria includes 80 #Dams , 8800 boreholes, 11 #Desalination plants, 21 transfers (upstream ...  URL:  https://t.co/lZBTbWWVRF | TAGS: #Foggara #TraditionalWaterCollection #WaterInfrastructureInAlgeria #Fanack Water  https://t.co/tvEUJQewRF",en,[],['https://is.gd/0bEihU'],['https://pbs.twimg.com/media/EAyvjp-X4AADTHV.jpg'],0,1,2,"['dams', 'desalination', 'foggara', 'traditionalwatercollection', 'waterinfrastructureinalgeria', 'fanack']",[],https://twitter.com/FanackMENA/status/1156492233354489856,FALSE,,1,https://pbs.twimg.com/media/EAyvjp-X4AADTHV.jpg,,,,,,,[],,,,
