id,conversation_id,created_at,date,time,timezone,user_id,username,name,place,tweet,language,mentions,urls,photos,replies_count,retweets_count,likes_count,hashtags,cashtags,link,retweet,quote_url,video,thumbnail,near,geo,source,user_rt_id,user_rt,retweet_id,reply_to,retweet_date,translate,trans_src,trans_dest
9.6234E+17,9.6234E+17,2018-02-10 15:00:02 UTC,10-02-2018,15:00:02,0,3560045421,ecomnewsmed,ECOMNEWSMED,,"La 5ème édition du Salon international des #transports, de la #logistique et de la #mobilité, «#Algeria Infrastructure 2018», s’ouvre le 12 février à la Safex @sonatrach_dz @Ministere_com_A @WorldBankMENA #UEmed  https://t.co/kn5oyHW4NI",fr,"[{'screen_name': 'sonatrach_dz', 'name': 'sonatrach', 'id': '4915427019'}, {'screen_name': 'ministere_com_a', 'name': 'ministèrecommerce_dz', 'id': '777460036402548736'}, {'screen_name': 'worldbankmena', 'name': 'world bank mena', 'id': '2326228160'}]",[],['https://pbs.twimg.com/media/DVlHFaVXcAAGlNB.jpg'],0,0,1,"['transports', 'logistique', 'mobilité', 'algeria', 'uemed']",[],https://twitter.com/ecomnewsmed/status/962340389196791808,FALSE,,1,https://pbs.twimg.com/media/DVlHFaVXcAAGlNB.jpg,,,,,,,[],,,,
9.61908E+17,9.61908E+17,2018-02-09 10:22:03 UTC,09-02-2018,10:22:03,0,9.01063E+17,algeria_b2b,Made in Algeria B2B,,"#Algeria_Infrastructure 2018  Le Salon International des Transports, de la Logistique et de la Mobilité en...  https://t.co/hVH3elCtdO",fr,[],['https://fb.me/9in2rgj9U'],[],0,0,0,['algeria_infrastructure'],[],https://twitter.com/Algeria_B2B/status/961908044924796928,FALSE,,0,,,,,,,,[],,,,
9.61544E+17,9.61544E+17,2018-02-08 10:14:13 UTC,08-02-2018,10:14:13,0,350889826,danem94,Danem,,Danem sera présent au côté de son partenaire Gpe Merabti lors de la 5ème édition du Salon ALGERIA INFRASTRUCTURE 2018 qui a lieu du 12 au 14 Février 2018. #Algerie #Logistics #events #mobilite #tranports  https://t.co/wppFoXa8uJ,fr,[],[],['https://pbs.twimg.com/media/DVgVopkW0AA3WBp.jpg'],0,0,0,"['algerie', 'logistics', 'events', 'mobilite', 'tranports']",[],https://twitter.com/DANEM94/status/961543683203129344,FALSE,,1,https://pbs.twimg.com/media/DVgVopkW0AA3WBp.jpg,,,,,,,[],,,,
9.61176E+17,9.61176E+17,2018-02-07 09:53:16 UTC,07-02-2018,09:53:16,0,8.06524E+17,dzbreaking1,DZ Breaking,,"#Algeria_Infrastructure 2018 (12-15 February 2018): Transport, Logistics and Mobility #Exhibition  https://t.co/Jemg5Unz4T  https://t.co/cLJL4O6LiQ",en,[],['https://www.dzbreaking.com/2018/02/07/algeria-infrastructure-2018-12-15-february-2018-transport-logistics-mobility-exhibition'],['https://pbs.twimg.com/media/DVbIfEXXUAMIvmh.jpg'],0,0,0,"['algeria_infrastructure', 'exhibition']",[],https://twitter.com/dzbreaking1/status/961176024636633088,FALSE,,1,https://pbs.twimg.com/media/DVbIfEXXUAMIvmh.jpg,,,,,,,[],,,,
9.60822E+17,9.60822E+17,2018-02-06 10:25:11 UTC,06-02-2018,10:25:11,0,4806099899,invest_algeria,Invest in Algeria,,[ Event ] #Business #Algiers #Alger Coming soon  Algeria Infrastructure 👀...  https://t.co/3DnWFMBx3e …  https://t.co/BLWwQFzjVQ,en,[],['http://infrastructure-dz.com/pages/fr/index.php'],['https://pbs.twimg.com/media/DVWGMQbWkAAMcxZ.jpg'],0,6,4,"['business', 'algiers', 'alger']",[],https://twitter.com/invest_algeria/status/960821670029266944,FALSE,,1,https://pbs.twimg.com/media/DVWGMQbWkAAMcxZ.jpg,,,,,,,[],,,,
9.60492E+17,9.60435E+17,2018-02-05 12:34:20 UTC,05-02-2018,12:34:20,0,1412879497,variousjane,Jane,,"@UAVInspection @btbusinesscare Dear lord, please deliver us from this monopolistic retrograde national infrastructure, and grant us 5G. With these speeds, we haven’t even a hope of competing with Venezuela, Algeria, or Uzbekistan  https://t.co/bGxb1KuCuh. #betterconnectivity #bt #infrustration",en,[],['http://www.speedtest.net/global-index#fixed'],[],0,0,1,"['betterconnectivity', 'bt', 'infrustration']",[],https://twitter.com/variousjane/status/960491783762440192,FALSE,,0,,,,,,,,"[{'screen_name': 'UAVInspection', 'name': 'UAV Inspection', 'id': '985246139929722880'}, {'screen_name': 'btbusinesscare', 'name': 'BT Business Care', 'id': '20009086'}]",,,,
9.60476E+17,9.60476E+17,2018-02-05 11:30:07 UTC,05-02-2018,11:30:07,0,125621231,royalihc,Royal IHC,,"#IHC has been invited to #Algeria #Infrastructure on 12-14 Feb at Algiers SAFEX. The event covers international #transport, #logistics and mobility in the country. Come visit us at the Dutch Pavilion!  https://t.co/jDnMnQjrLa",en,[],[],['https://pbs.twimg.com/media/DVRLfNEVwAUu5nH.jpg'],0,2,7,"['ihc', 'algeria', 'infrastructure', 'transport', 'logistics']",[],https://twitter.com/royalihc/status/960475622551310336,FALSE,,1,https://pbs.twimg.com/media/DVRLfNEVwAUu5nH.jpg,,,,,,,[],,,,
9.60454E+17,9.60454E+17,2018-02-05 10:04:46 UTC,05-02-2018,10:04:46,0,9.32894E+17,cashassurances,CASH Assurances,,"Rendez-vous du 12 au 14 février 2018 à la SAFEX pour le salon international des transport, de la logistique et de la mobilité ""Algeria infrastructure 2018"" en sa 5ème édition. L'événement qui rassemblera les secteurs du transport ferroviaire, aérien, routier et maritime.  https://t.co/U5yD9IXbuC",fr,[],[],['https://pbs.twimg.com/media/DVQ3vP0X4AAvPR7.jpg'],0,0,1,[],[],https://twitter.com/CASHassurances/status/960454142539059200,FALSE,,1,https://pbs.twimg.com/media/DVQ3vP0X4AAvPR7.jpg,,,,,,,[],,,,
9.58973E+17,9.58973E+17,2018-02-01 07:59:44 UTC,01-02-2018,07:59:44,0,8.06524E+17,dzbreaking1,DZ Breaking,,"#Algeria, #China examine 5 industrial, port infrastructure projects  https://t.co/omuDMTpB0x  https://t.co/luDtz6h4C0",en,[],['https://www.dzbreaking.com/2018/02/01/algeria-china-examine-5-industrial-port-infrastructure-projects'],['https://pbs.twimg.com/media/DU709wOXcAA5eym.jpg'],0,0,0,"['algeria', 'china']",[],https://twitter.com/dzbreaking1/status/958973123344388096,FALSE,,1,https://pbs.twimg.com/media/DU709wOXcAA5eym.jpg,,,,,,,[],,,,
9.58469E+17,9.58449E+17,2018-01-30 22:37:46 UTC,30-01-2018,22:37:46,0,1288986829,lindaquackenbus,Linda Quackenbush,,"@gatheringspeed0 @JeffBales6 @ROYALMRBADNEWS @TomFitton HRC also sent AmeriCorps volunteers 2Qatar to help build Net infrastructure! Also, ""multiple foreign governments, including Algeria, Kuwait, Qatar and Oman, donated millions of dollars to the Clinton Foundation while she was secretary of state""&gt; https://t.co/9mbbd9q9pw",en,[],['http://www.chicagotribune.com/news/opinion/commentary/ct-hillary-clinton-emails-whitehaven-foundation-perspec-0306-jm-20150305-story.html'],[],1,3,5,[],[],https://twitter.com/Lindaquackenbus/status/958469312448290817,FALSE,,0,,,,,,,,"[{'screen_name': 'gatheringspeed0', 'name': 'D', 'id': '4749802201'}, {'screen_name': 'JeffBales6', 'name': 'It’s 1776 Reporting for duty JeffBales6 ⭐️⭐️⭐️', 'id': '3945784187'}, {'screen_name': 'ROYALMRBADNEWS', 'name': 'THE REAL DARK JUDGE', 'id': '102268811'}]",,,,
9.58406E+17,9.58406E+17,2018-01-30 18:26:50 UTC,30-01-2018,18:26:50,0,450803101,forever_algeria,Algeria Forever,,☑️Imane Houda Faraoun nie l’existence d’un monopole chinois sur les infrastructures technologiques en Algérie...  https://t.co/mZPyEymHaU,fr,[],['https://fb.me/8j1uMqtWN'],[],0,0,0,[],[],https://twitter.com/forever_algeria/status/958406164835917825,FALSE,,0,,,,,,,,[],,,,
9.56551E+17,9.56548E+17,2018-01-25 15:34:37 UTC,25-01-2018,15:34:37,0,8.89832E+17,txduke66,KT,,@NBCNews Give me one reason we should be giving them a single dime? We gave Algeria $5M and they turned around and gave $500K to the Clinton Foundation - Evidently they did not need our foreign aid. Stop the stupidity and use the money for infrastructure.,en,[],[],[],0,0,0,[],[],https://twitter.com/txduke66/status/956550886188306432,FALSE,,0,,,,,,,,"[{'screen_name': 'NBCNews', 'name': 'NBC News', 'id': '14173315'}]",,,,
9.56038E+17,9.56038E+17,2018-01-24 05:37:54 UTC,24-01-2018,05:37:54,0,1044217464,kenyanwalstreet,Kenyan Wallstreet,,Ranking of Africa's Infrastructure Development According to AFDB (2018);  1. Seychelles 90% 2. Tunisia 85% 3. Egypt 84% 4. S.A 83% 5. Morocco 83% 6. Mauritius 81% 7. Algeria 60% 8. Cape Verde 55% 9. Botswana 38% 10. Gambia 34% 11. Kenya 33%  https://t.co/ELGE4UK8YV,en,[],['https://wp.me/p8hE44-4nh'],[],4,78,51,[],[],https://twitter.com/kenyanwalstreet/status/956038327131607040,FALSE,,0,,,,,,,,[],,,,
9.55751E+17,9.55727E+17,2018-01-23 10:34:19 UTC,23-01-2018,10:34:19,0,436306334,euromedhr,Euro-Med Monitor,,#UPR29| #Algeria recommends #Israel to allow accessing to necessary resource for people in occupied areas; allow upkeep of Palestinian infrastructure; end HR violations in Palestinian territories in all forms  https://t.co/65Bs0E5Fyb,en,[],[],['https://pbs.twimg.com/media/DUOCCD1XUAEX42X.jpg'],1,4,0,"['upr29', 'algeria', 'israel']",[],https://twitter.com/EuroMedHR/status/955750536493568000,FALSE,,1,https://pbs.twimg.com/media/DUOCCD1XUAEX42X.jpg,,,,,,,[],,,,
9.555E+17,9.555E+17,2018-01-22 17:57:49 UTC,22-01-2018,17:57:49,0,32382071,nlawglobal,NortonRoseFulbright,,Christophe Asselineau looks at the changes need to facilitate foreign investments into Algeria’s growing private sector &amp; infrastructure projects. Find out more. #AfricaLaw  https://t.co/FCxcRsRZz1  https://t.co/IV4uPgNsDj,en,[],['http://ow.ly/Bs9030hVJU8'],['https://pbs.twimg.com/media/DUKd90mW0AECIRu.jpg'],0,0,0,['africalaw'],[],https://twitter.com/NLawGlobal/status/955499759820779520,FALSE,,1,https://pbs.twimg.com/media/DUKd90mW0AECIRu.jpg,,,,,,,[],,,,
9.53955E+17,9.53903E+17,2018-01-18 11:40:19 UTC,18-01-2018,11:40:19,0,81869176,zehavoc,Djamé,,"@ZeerakW @LeonDerczynski @naf1zh Algeria never needed tourism to back up its economy so their touristic infrastructures are super neglected, Algerian go to holidays in Tunisia. And regarding the attitude, it depends where you're hanging around. people are cool don't get me wrong, but not everyone.",en,[],[],[],1,0,1,[],[],https://twitter.com/zehavoc/status/953955205707698176,FALSE,,0,,,,,,,,"[{'screen_name': 'ZeerakW', 'name': 'Zeerak Waseem', 'id': '166479009'}, {'screen_name': 'LeonDerczynski', 'name': 'Leon Derczynski 🎄🍷\U0001fab5🔥', 'id': '477030336'}]",,,,
9.53262E+17,9.53262E+17,2018-01-16 13:45:08 UTC,16-01-2018,13:45:08,0,389716201,algeria_tweet,Algeria 🇩🇿 الجزائر,,Infrastructures : Le stade de Douera prend forme  https://t.co/MzqDH6xuwv #Algérie  https://t.co/EFFPD2dswG,fr,[],['http://bit.ly/2DaKUzZ'],['https://pbs.twimg.com/media/DTqqlx_U8AAhNCO.jpg'],0,0,5,['algérie'],[],https://twitter.com/Algeria_Tweet/status/953261840154243073,FALSE,,1,https://pbs.twimg.com/media/DTqqlx_U8AAhNCO.jpg,,,,,,,[],,,,
9.5277E+17,9.52766E+17,2018-01-15 05:09:51 UTC,15-01-2018,05:09:51,0,160028242,wash_stl,Tengo Dividend,,"@CNN A ""sh#thole country"" has nothing 2 do w the race of the people...it has to do with infrastructure, technology, education, poverty, medical facilities, government corruption &amp; in many parts of Africa - (Somalia, Sudan, Lybia, Algeria, Niger, etc) extremist jihadists...that simple!",en,[],[],[],0,0,1,[],[],https://twitter.com/wash_STL/status/952769778292350977,FALSE,,0,,,,,,,,"[{'screen_name': 'CNN', 'name': 'CNN', 'id': '759251'}]",,,,
9.52531E+17,9.52531E+17,2018-01-14 13:22:00 UTC,14-01-2018,13:22:00,0,2316746954,daliazinaghanem,Dr. Dalia Ghanem,,#Algeria has a tremendous potential in #Tourisme but 2 factors are impeding its blooming :a) it lacks some infrastructures 2) the #visa procedure is still too long.  https://t.co/Fps3VZYqf3,en,[],['https://www.alg24.net/visas-infrastructures-freinent-tourisme-algerie/'],[],0,1,7,"['algeria', 'tourisme', 'visa']",[],https://twitter.com/DaliaZinaGhanem/status/952531244503400449,FALSE,,0,,,,,,,,[],,,,
9.50647E+17,9.50647E+17,2018-01-09 08:34:20 UTC,09-01-2018,08:34:20,0,398817077,valeriemarcel,Dr Valérie Marcel,,Sonatrach may invest in gas in Iraq as country struggles to make productive use of flared gas. But presumably Algeria would also need to export its enabling infrastructure and policy...   https://t.co/Tvj9KyfIWG,en,[],['https://www.reuters.com/article/us-iraq-algeria-oil/algerias-sonatrach-may-invest-in-iraqs-oil-exploration-natural-gas-industry-idUSKBN1EW0KG'],[],0,0,3,[],[],https://twitter.com/ValerieMarcel/status/950646910183985152,FALSE,,0,,,,,,,,[],,,,
9.5011E+17,9.5011E+17,2018-01-07 21:01:23 UTC,07-01-2018,21:01:23,0,9.44984E+17,conexia_net,Conexia Consulting,,"Infrastructure Support Analyst (Data Centre) #algerie, #Algeria, #jobs #emploi  https://t.co/bZ2URrOqr6",fr,[],['http://conexia.net/en/career/infrastructure-support-analyst-data-centre/'],[],0,0,0,"['algerie', 'algeria', 'jobs', 'emploi']",[],https://twitter.com/conexia_net/status/950110136273637376,FALSE,,0,,,,,,,,[],,,,
9.47355E+17,9.47326E+17,2017-12-31 06:34:22 UTC,31-12-2017,06:34:22,0,3343688313,uidc_ug,UIDC,,@alon_levy Certainly Africa (besides South Africa and Algeria) does not manufacture such heavy duty equipment required in infrastructure construction which are now on high demand,en,[],[],[],1,0,0,[],[],https://twitter.com/UIDC_UG/status/947355230458523648,FALSE,,0,,,,,,,,"[{'screen_name': 'alon_levy', 'name': 'Alon Levy (u/uni)', 'id': '15398150'}]",,,,
9.47153E+17,9.47153E+17,2017-12-30 17:11:11 UTC,30-12-2017,17:11:11,0,120499199,jonmlevine,Jonathan Levine,,"“@Nyotron...says it has spotted a threat actor with likely links to Saudi Arabia, Iran, or Algeria using a repurposed #malware tool to target specific critical infrastructure organizations in the Middle East.”  https://t.co/L9sK3EGyJ5",en,"[{'screen_name': 'nyotron', 'name': 'nyotron security', 'id': '773700301832462337'}]",['http://j.mp/2EjiZz4'],[],0,4,2,['malware'],[],https://twitter.com/JonMLevine/status/947153101718474752,FALSE,,0,,,,,,,,[],,,,
9.45028E+17,9.44974E+17,2017-12-24 20:25:27 UTC,24-12-2017,20:25:27,0,8.8401E+17,mezimust1,Mustapha,,"@Algeria_Tweet Quelque soit la beauté de l'infrastructure, tant que la mentalité pourrie de ceux qui y travaillent ne change pas, c'est comme si on pissait en l'air!...",fr,[],[],[],1,0,1,[],[],https://twitter.com/mezimust1/status/945027663902707713,FALSE,,0,,,,,,,,"[{'screen_name': 'Algeria_Tweet', 'name': 'Algeria 🇩🇿 الجزائر', 'id': '389716201'}]",,,,
9.43273E+17,9.4326E+17,2017-12-20 00:11:40 UTC,20-12-2017,00:11:40,0,7.99757E+17,sleepyanglo,NOT SirAnglo,,"@380kmh I read all your points and I think you are unfair.  You ASSUME that the DC/Philly/New Jersey/NYC/Boston corridor is capable of producing the infrastructure, commerce base, and population critical numbers as... squints...  ... Algeria.",en,[],[],[],0,0,1,[],[],https://twitter.com/SleepyAnglo/status/943272655905583104,FALSE,,0,,,,,,,,"[{'screen_name': '380kmh', 'name': 'Alex ""Boreal"" Forrest 🚉🎄', 'id': '265481588'}]",,,,
9.42998E+17,9.42998E+17,2017-12-19 06:00:26 UTC,19-12-2017,06:00:26,0,244873412,obginsights,OxfordBusinessGroup,,Will improved infrastructure and human resources help Algeria expand its tourism industry?  https://t.co/dNGK9fjA4M @wef,en,"[{'screen_name': 'wef', 'name': 'world economic forum', 'id': '5120691'}]",['http://ow.ly/o2Fn30hi1eZ'],[],0,1,1,[],[],https://twitter.com/OBGinsights/status/942998036283908096,FALSE,,0,,,,,,,,[],,,,
9.41771E+17,9.41771E+17,2017-12-15 20:46:00 UTC,15-12-2017,20:46:00,0,122801957,oaco2_yenit,Guzmán,,infrastructure projects in algeria a country size construction site:  https://t.co/FdqNUjYt9w via @YouTube,en,"[{'screen_name': 'youtube', 'name': 'youtube', 'id': '10228272'}]",['http://youtu.be/uhIVjMxH5kM?a'],[],0,0,0,[],[],https://twitter.com/Oaco2_Yenit/status/941771345238679552,FALSE,,0,,,,,,,,[],,,,
9.41467E+17,9.4034E+17,2017-12-15 00:37:10 UTC,15-12-2017,00:37:10,0,152652501,apspusa,African People’s Socialist Party,,@MiddleEastEye French soldiers are in Algeria TODAY(!) protecting the infrastructure to continue to steal Algeria’s resources today. This is colonialism &amp; the colonizer needs the colonized to accept it to work for them.,en,[],[],[],0,0,0,[],[],https://twitter.com/APSPusa/status/941467133732630528,FALSE,,0,,,,,,,,"[{'screen_name': 'MiddleEastEye', 'name': 'Middle East Eye', 'id': '2373735295'}]",,,,
9.40244E+17,9.40235E+17,2017-12-11 15:36:21 UTC,11-12-2017,15:36:21,0,2994300575,atlasblidi,Krimo,,@bylka613 Stadiums are jus a small piece of the puzzle. We don't have Football infrastructure in Algeria. Including stadiums.,en,[],[],[],1,0,0,[],[],https://twitter.com/AtlasBlidi/status/940243867072417793,FALSE,,0,,,,,,,,"[{'screen_name': 'bylka613', 'name': 'Walid Bylka', 'id': '860512088057401344'}]",,,,
9.38809E+17,9.38809E+17,2017-12-07 16:33:03 UTC,07-12-2017,16:33:03,0,4718140883,bienvenueatous,#EvelineCoaching 🇬🇳🇬🇶🇨🇮🇨🇲🇫🇷🇨🇦,,Infrastructure: Algeria: a model for Africa     https://t.co/phYLpH7jPJ,ca,[],['http://afrique-dedemain.blogspot.com/2017/09/infrastructuresalgerie-un-modele-pour.html?spref=tw'],[],0,0,0,[],[],https://twitter.com/bienvenueatous/status/938808585911521281,FALSE,,0,,,,,,,,[],,,,
9.37708E+17,9.37708E+17,2017-12-04 15:38:52 UTC,04-12-2017,15:38:52,0,4718140883,bienvenueatous,#EvelineCoaching 🇬🇳🇬🇶🇨🇮🇨🇲🇫🇷🇨🇦,,Infrastructure: Algeria: a model for Africa     https://t.co/phYLpH7jPJ,ca,[],['http://afrique-dedemain.blogspot.com/2017/09/infrastructuresalgerie-un-modele-pour.html?spref=tw'],[],0,0,0,[],[],https://twitter.com/bienvenueatous/status/937707784975605762,FALSE,,0,,,,,,,,[],,,,
9.36368E+17,9.36368E+17,2017-11-30 22:53:38 UTC,30-11-2017,22:53:38,0,9.06122E+17,retailerdata,Retailer Surveys,,#Algeria : UNO : Nov 2017 adequate profit.  https://t.co/HcSzgHbv4v #NewMR #PriceConscious #Stores #Infrastructure #Choice #mrx,ca,[],['http://dg-di.us/OMS/AG/706020.html'],[],0,0,0,"['algeria', 'newmr', 'priceconscious', 'stores', 'infrastructure', 'choice', 'mrx']",[],https://twitter.com/RetailerData/status/936367645535895552,FALSE,,0,,,,,,,,[],,,,
9.36173E+17,9.36173E+17,2017-11-30 10:01:49 UTC,30-11-2017,10:01:49,0,442666745,tensarinsights,Tensar Insights,,#Tensar and #Geomag are exhibiting at the 15th Salon International des Travaux Publics from 28/11 to 2/12 in #Algiers. Pay us a visit to speak #infrastructure in #Algeria #SITP  https://t.co/jguiCySF5O,en,[],[],"['https://pbs.twimg.com/media/DP30n8iW4AAZQ9D.jpg', 'https://pbs.twimg.com/media/DP30omFXkAAUwgs.jpg']",0,2,2,"['tensar', 'geomag', 'algiers', 'infrastructure', 'algeria', 'sitp']",[],https://twitter.com/TensarInsights/status/936173412359331841,FALSE,,1,https://pbs.twimg.com/media/DP30n8iW4AAZQ9D.jpg,,,,,,,[],,,,
9.33894E+17,9.33894E+17,2017-11-24 03:03:29 UTC,24-11-2017,03:03:29,0,9.06122E+17,retailerdata,Retailer Surveys,,#Algeria : Lufian : Nov 2017 weak profit.  https://t.co/LhResrO6SH #Demand #Value #Infrastructure #Sites #MarketAnalysis #NewMR,in,[],['http://dg-di.us/OMS/AG/666140.html'],[],0,0,0,"['algeria', 'demand', 'value', 'infrastructure', 'sites', 'marketanalysis', 'newmr']",[],https://twitter.com/RetailerData/status/933893807271219200,FALSE,,0,,,,,,,,[],,,,
9.33614E+17,9.33614E+17,2017-11-23 08:32:52 UTC,23-11-2017,08:32:52,0,365335412,atlanticclubbg,Atlantic Club of Bulgaria,,#NATO and 🇩🇿 hold #workshop on critical energy infrastructure security #WeAreNATO #Algeria   https://t.co/vbawrkjDL0  https://t.co/qc9IMKxr7A,en,[],['https://www.nato.int/cps/en/natohq/news_149022.htm'],['https://pbs.twimg.com/media/DPTdPZ7W0AAXfsS.jpg'],0,0,1,"['nato', 'workshop', 'wearenato', 'algeria']",[],https://twitter.com/AtlanticClubBG/status/933614312643493888,FALSE,,1,https://pbs.twimg.com/media/DPTdPZ7W0AAXfsS.jpg,,,,,,,[],,,,
9.33255E+17,9.33255E+17,2017-11-22 08:46:45 UTC,22-11-2017,08:46:45,0,2272986883,espmalistrategy,Mali Sahel-Elite,,NATO and Algeria hold workshop on critical energy infrastructure security  https://t.co/perKEL5cue  https://t.co/USYNOiqzzz,en,[],['http://httpsahel-elite.com/2017/11/22/nato-and-algeria-hold-workshop-on-critical-energy-infrastructure-security/'],['https://pbs.twimg.com/media/DPOW2tiVwAEGxuO.jpg'],0,0,0,[],[],https://twitter.com/EspMaliStrategy/status/933255416963784705,FALSE,,1,https://pbs.twimg.com/media/DPOW2tiVwAEGxuO.jpg,,,,,,,[],,,,
9.32925E+17,9.32925E+17,2017-11-21 10:54:28 UTC,21-11-2017,10:54:28,0,2900782241,italyatnato,🇮🇹 Italy at NATO,,#ICYMI: #NATO and #Algeria 🇩🇿 held workshop on critical energy infrastructure security  https://t.co/MkILrVsjr7  https://t.co/t0gXhSmT0w,en,[],['http://ow.ly/fWRV30gIkRL'],['https://pbs.twimg.com/media/DPJqegSWkAAmOrb.jpg'],0,3,2,"['icymi', 'nato', 'algeria']",[],https://twitter.com/ItalyatNATO/status/932925172281233408,FALSE,,1,https://pbs.twimg.com/media/DPJqegSWkAAmOrb.jpg,,,,,,,[],,,,
9.32864E+17,9.32864E+17,2017-11-21 06:52:20 UTC,21-11-2017,06:52:20,0,7.66653E+17,themaghrebtimes,The Maghreb Times 🇩🇿🇱🇾🇲🇦🇲🇷🇹🇳🇵🇸,,#NATO and #Algeria hold workshop on critical energy infrastructure #security  https://t.co/LYQHlPiyWT via @TheMaghrebTimes,en,"[{'screen_name': 'themaghrebtimes', 'name': 'the maghreb times 🇩🇿🇱🇾🇲🇦🇲🇷🇹🇳🇵🇸', 'id': '766653367049392128'}]",['https://themaghrebtimes.com/11/21/nato-and-algeria-hold-workshop-on-critical-energy-infrastructure-security/'],[],0,1,0,"['nato', 'algeria', 'security']",[],https://twitter.com/TheMaghrebTimes/status/932864237768200198,FALSE,,0,,,,,,,,[],,,,
9.32712E+17,9.32572E+17,2017-11-20 20:46:33 UTC,20-11-2017,20:46:33,0,2865660093,cadefa_algerie,CADEFA-AFRIQUE,,"@Klm49385485 En message direct comme vous venez de le faire, si vous souhaitez recevoir la documentation concernant Algéria infrastructure veuillez m'envoyer un mail à  contact@cadefa.org",fr,[],[],[],2,0,0,[],[],https://twitter.com/CADEFA_ALGERIE/status/932711784863227908,FALSE,,0,,,,,,,,"[{'screen_name': 'Klm49385485', 'name': 'Klm', 'id': '779051954081263617'}]",,,,
9.32608E+17,9.32608E+17,2017-11-20 13:56:05 UTC,20-11-2017,13:56:05,0,7.38736E+17,aircrafttracks,Defence News,,"NATO and Algeria hold workshop on critical energy infrastructure security Energy experts from Algeria and NATO met in the city of Hassi Messaoud, Southern Algeria, on 14-15 November 2017 to discuss critical energy infrastructure security.  https://t.co/EJT26OsyxC",en,[],['http://ift.tt/2j88t3C'],[],0,0,0,[],[],https://twitter.com/AircraftTracks/status/932608487808552960,FALSE,,0,,,,,,,,[],,,,
9.32605E+17,9.32605E+17,2017-11-20 13:41:08 UTC,20-11-2017,13:41:08,0,29106490,imax111,iDEFY,,NATO and Algeria hold workshop on critical energy infrastructure security:  https://t.co/gN024rMdzb,en,[],['http://ift.tt/2zX9pju'],[],0,0,0,[],[],https://twitter.com/imax111/status/932604727627534336,FALSE,,0,,,,,,,,[],,,,
9.32572E+17,9.32572E+17,2017-11-20 11:30:07 UTC,20-11-2017,11:30:07,0,2865660093,cadefa_algerie,CADEFA-AFRIQUE,,"Nous organisons le Pavillion France du salon Algeria Infrastructure 2018,Salon international du transports de la logistique et de la mobilité  du 12 au 14 février 2018. Pour infos complémentaires me contacter en MD",fr,[],[],[],1,0,1,[],[],https://twitter.com/CADEFA_ALGERIE/status/932571755633397760,FALSE,,0,,,,,,,,[],,,,
9.30365E+17,9.30365E+17,2017-11-14 09:19:39 UTC,14-11-2017,09:19:39,0,2414042364,unalgeria,Nations Unies-Algérie,,Fatou Haidara @UNIDO : le mandat de l'@unido est au cœur des #SDGs #ODD9 #industrie #innovation #infrastructure Conf. Rég. #créativité #emploi #Developpement_economique #Sud_mediterranée  .@UfMSecretariat .@UNIDO_Algeria .@UNIDO .@UN  https://t.co/QlaO52MH2v,fr,"[{'screen_name': 'unido', 'name': 'unido', 'id': '16145473'}, {'screen_name': 'unido', 'name': 'unido', 'id': '16145473'}, {'screen_name': 'ufmsecretariat', 'name': 'union for the mediterranean', 'id': '317042569'}, {'screen_name': 'unido_algeria', 'name': 'unido algeria', 'id': '866579228271284225'}, {'screen_name': 'unido', 'name': 'unido', 'id': '16145473'}, {'screen_name': 'un', 'name': 'united nations', 'id': '14159148'}]",[],"['https://pbs.twimg.com/media/DOlQr-VXkAA7aTo.jpg', 'https://pbs.twimg.com/media/DOlRd1MWAAA5ZSy.jpg', 'https://pbs.twimg.com/media/DOlRihjWsAArS7R.jpg']",0,3,9,"['sdgs', 'odd9', 'industrie', 'innovation', 'infrastructure', 'créativité', 'emploi', 'developpement_economique', 'sud_mediterranée']",[],https://twitter.com/UNALGERIA/status/930364594903805952,FALSE,,1,https://pbs.twimg.com/media/DOlQr-VXkAA7aTo.jpg,,,,,,,[],,,,
9.28946E+17,9.28582E+17,2017-11-10 11:23:41 UTC,10-11-2017,11:23:41,0,162189374,caisersoze84,tayeb,,"@MnarviDZ Few years after 62 (maybe 66 ), Algeria needed to develop its energy infrastructure independently of France, the UK was one of the options. it’s all in Houcine Malti’s book, along with a nice anecdote about Belaid Abdessalem.",en,[],[],[],1,0,0,[],[],https://twitter.com/caisersoze84/status/928946255878934528,FALSE,,0,,,,,,,,"[{'screen_name': 'MnarviDZ', 'name': 'Relaxed', 'id': '192236357'}]",,,,
9.23492E+17,9.23492E+17,2017-10-26 10:10:15 UTC,26-10-2017,10:10:15,0,9.06122E+17,retailerdata,Retailer Surveys,,#Algeria : Ruban Rouge : Oct 2017 frail profit.  https://t.co/OxV7YA7WmE #Demand #NewMR #Infrastructure #Buying #MarketAnalysis,en,[],['http://dg-di.us/OMS/AG/689109.html'],[],0,0,0,"['algeria', 'demand', 'newmr', 'infrastructure', 'buying', 'marketanalysis']",[],https://twitter.com/RetailerData/status/923491961776099328,FALSE,,0,,,,,,,,[],,,,
9.18488E+17,9.18488E+17,2017-10-12 14:47:53 UTC,12-10-2017,14:47:53,0,1968593114,newslinerindia,Newsliner.in,,Energy and Utilities Infrastructure Construction in Algeria to 2019: Market Forecast  https://t.co/lkyucVJyHL,en,[],['http://fb.me/8SSw1osfW'],[],0,0,0,[],[],https://twitter.com/NewslinerIndia/status/918488397966065664,FALSE,,0,,,,,,,,[],,,,
9.18452E+17,9.18452E+17,2017-10-12 12:22:24 UTC,12-10-2017,12:22:24,0,66075500,bizpressrelease,BizPR,,Energy and Utilities Infrastructure Construction in Algeria to 2019: Market Forecast  https://t.co/esvZsgeekC,en,[],['https://goo.gl/fb/FWqfSo'],[],0,0,0,[],[],https://twitter.com/bizpressrelease/status/918451785974640640,FALSE,,0,,,,,,,,[],,,,
